{
  "schema_version": "1.0.0",
  "attachment_id": "lcapi-domestic-synthetic",
  "consumer_id": "lcapi",
  "consumer_identity_ref": "lcnd-identity://consumers/lcapi",
  "selectors": [{"provider": "synthetic-cn-provider", "model": "synthetic-model", "channel": "chat", "target_set_ref": "lcnd-targets://lcapi/domestic-synthetic"}],
  "route": {"id": "lcnd-egress-cn", "class": "china_egress"},
  "endpoint_ref": "lcnd-endpoint://loopback/egress-cn",
  "credential_ref": "lcnd-secret://lcsp/egress-cn/lcapi",
  "timeouts": {"connect_ms": 3000, "request_ms": 30000, "idle_ms": 60000},
  "failure_policy": {"mode": "approved_direct", "approved_route_id": "direct"},
  "business_probe_ref": "lcnd-probe://lcapi/domestic-synthetic",
  "rollback": {"detach_only": true, "restore_route_id": "direct"},
  "production_authorized": false
}
